{
  "$comment": "Code generated by tools/ci generate. DO NOT EDIT.\nSource: tools/schemagen (the Go type github.com/brunovenceslau/romeu-e-julieta/internal/cmd/julieta/memory.Report)\n\nGenerated by this command:\n\n\tgo generate ./...\n",
  "$schema": "https://json-schema.org/draft/2020-12/schema",
  "additionalProperties": false,
  "properties": {
    "entries": {
      "items": {
        "additionalProperties": false,
        "properties": {
          "body": {
            "type": "string"
          },
          "createdAt": {
            "format": "date-time",
            "type": "string"
          },
          "id": {
            "type": "string"
          },
          "path": {
            "type": "string"
          },
          "status": {
            "type": "string"
          },
          "tags": {
            "items": {
              "type": "string"
            },
            "type": "array"
          },
          "title": {
            "type": "string"
          },
          "updatedAt": {
            "format": "date-time",
            "type": "string"
          }
        },
        "required": [
          "body",
          "createdAt",
          "id",
          "path",
          "status",
          "tags",
          "title",
          "updatedAt"
        ],
        "type": "object"
      },
      "type": "array"
    },
    "repo": {
      "type": "string"
    },
    "schema": {
      "const": "julieta-memory/v1",
      "type": "string"
    },
    "wrote": {
      "type": "boolean"
    }
  },
  "required": [
    "entries",
    "repo",
    "schema",
    "wrote"
  ],
  "title": "julieta-memory.v1",
  "type": "object"
}
