{"entries":[{"body":"On arm64.\n","createdAt":"2026-10-20T12:00:00Z","id":"01j9z3k8m6t2q4w5e7r9y1v3k5","path":"/memory/api/entries/01j9z3k8m6t2q4w5e7r9y1v3k5.md","status":"open","tags":["arm64","ci"],"title":"Flaky test","updatedAt":"2026-10-20T12:00:00Z"}],"repo":"api","schema":"julieta-memory/v1","wrote":true}
